{
    "projectTitle": "Gender Sensitization Trainings - <i>Surat</i>",
    "aboutTabData": {
        "imageURL": "",
        "aboutDatas": {
            "textData": [
                "Workshops for bus crews using role-plays, real cases, legal grounding, and helpline drills instead of lectures"
            ]
        }
    },
    "videosTabData": {
        "videoDatas": [],
        "idleTimeout": 2.0
    },
    "galleryTabData": {
        "galleryDatas": []
    },
    "dashboardTabData": {
        "imageVideosURLs": []
    },
    "reportsTabData": {
        "reportDatas": [
            {
                "pdfURL": "Reports/1.pdf",
                "titleText": "Safe And Equal Journey"
            }
        ]
    }
}