{
    "projectTitle": "Bus Network Planning & Scheduling",
    "aboutTabData": {
        "imageURL": "",
        "aboutDatas": {
            "textData": [
                "Route rationalisation and optimised scheduling for the city bus network, improving coverage, frequency, and fleet utilisation across Rajkot"
            ]
        }
    },
    "videosTabData": {
        "videoDatas": [],
        "idleTimeout": 2.0
    },
    "galleryTabData": {
        "galleryDatas": [
            {
                "imageURL": "Gallery/1 (1).jpg",
                "titleText": "‎"
            },{
                "imageURL": "Gallery/1 (2).jpg",
                "titleText": "‎"
            },{
                "imageURL": "Gallery/1 (3).jpg",
                "titleText": "‎"
            },{
                "imageURL": "Gallery/1 (4).jpg",
                "titleText": "‎"
            },{
                "imageURL": "Gallery/1 (5).jpg",
                "titleText": "‎"
            },{
                "imageURL": "Gallery/1 (6).jpg",
                "titleText": "‎"
            },{
                "imageURL": "Gallery/1 (7).jpg",
                "titleText": "‎"
            }
        ]
    },
    "dashboardTabData": {
        "imageVideosURLs": []
    },
    "reportsTabData": {
        "reportDatas": [
            {
                "pdfURL": "Reports/1.pdf",
                "titleText": "Comprehensive Bus Network Optimisation "
            },
            {
                "pdfURL": "Reports/2.pdf",
                "titleText": "Bus Route Network Planning and Scheduling"
            }
        ]
    }
}