{
    "projectTitle": "asdfasdf",
    "aboutTabData": {
        "imageURL": "",
        "factsTitle": "",
        "factsDatas": [
            {
                "leftText": "",
                "rightText": ""
            }
        ]
    },
    "videosTabData": {
        "videoDatas": [
            {
                "videoURL": "",
                "titleText": ""
            }
        ]
    },
    "galleryTabData": {
        "galleryDatas": [
            {
                "imageURL": "",
                "titleText": ""
            }
        ]
    },
    "dashboardTabData": {
        "imageVideosURLs": []
    },
    "reportsTabData": {
        "reportDatas": [
            {
                "pdfURl": "",
                "titleText": ""
            }
        ]
    }
}