{
    "projectTitle": "Journey Planning Application (RRL Saarthi)",
    "aboutTabData": {
        "imageURL": "",
        "aboutDatas": {
            "textData": [
                "Passenger app combining GTFS data, real-time GPS, e-ticketing, scheduling backend integration, and UPI payments in one interface."
            ]
        }
    },
    "videosTabData": {
        "videoDatas": [
            {
                "videoURL": "Videos/1.mp4",
                "titleText": "RRL SAARTHI promotion",
                "thumbnailURL": "Gallery/V1.jpg"
            }
        ],
        "idleTimeout": 2.0
    },
    "galleryTabData": {
        "galleryDatas": [
            {
                "imageURL": "Gallery/1 (1).jpg",
                "titleText": "‎`"
            },{
                "imageURL": "Gallery/1 (2).jpg",
                "titleText": "‎"
            },{
                "imageURL": "Gallery/1 (3).jpg",
                "titleText": "‎"
            },{
                "imageURL": "Gallery/1 (4).jpg",
                "titleText": "‎"
            },{
                "imageURL": "Gallery/1 (5).jpg",
                "titleText": "‎"
            },{
                "imageURL": "Gallery/1 (6).jpg",
                "titleText": "‎"
            },{
                "imageURL": "Gallery/1 (7).jpg",
                "titleText": "‎"
            }
        ]
    },
    "dashboardTabData": {
        "imageVideosURLs": []
    },
    "reportsTabData": {
        "reportDatas": [
            {
                "pdfURL": "Reports/1.pdf",
                "titleText": "RRL SAARTHI"
            }
        ]
    }
}