{
    "projectTitle": "TeSetasersdfa",
    "aboutTabData": {
        "imageURL": "",
        "aboutDatas": {
            "textData": [
                ""
            ]
        }
    },
    "videosTabData": {
        "videoDatas": [
            {
                "videoURL": "",
                "titleText": ""
            }
        ],
        "idleTimeout": 2.0
    },
    "galleryTabData": {
        "galleryDatas": [
            {
                "imageURL": "",
                "titleText": ""
            }
        ]
    },
    "dashboardTabData": {
        "imageVideosURLs": []
    },
    "reportsTabData": {
        "reportDatas": [
            {
                "textData": [
                    ""
                ],
                "titleText": ""
            }
        ]
    }
}