{
    "projectTitle": "Transforming Public Bicycle Sharing in Surat",
    "aboutTabData": {
        "imageURL": "",
        "aboutDatas": {
            "textData": [
                "Revamped the public bicycle-sharing system to improve usage, coverage, and integration with public transport across Surat."
            ]
        }
    },
    "videosTabData": {
        "videoDatas": [],
        "idleTimeout": 2.0
    },
    "galleryTabData": {
        "galleryDatas": [
            {
                "imageURL": "Gallery/1 (1).jpg",
                "titleText": "‎"
            },{
                "imageURL": "Gallery/1 (2).jpg",
                "titleText": "‎"
            },{
                "imageURL": "Gallery/1 (3).jpg",
                "titleText": "‎"
            },{
                "imageURL": "Gallery/1 (4).jpg",
                "titleText": "‎"
            },{
                "imageURL": "Gallery/1 (5).jpg",
                "titleText": "‎"
            }
        ]
    },
    "dashboardTabData": {
        "imageVideosURLs": []
    },
    "reportsTabData": {
        "reportDatas": [
            {
                "pdfURL": "Reports/1.pdf",
                "titleText": "Transforming Public Bicycle Sharing in Surat"
            }
        ]
    }
}