{
    "projectTitle": "Full Data Test",
    "aboutTabData": {
        "imageURL": "Gallery/image_12.jpg",
        "aboutDatas": {
            "textData": [
                "The projectdataeeeee initiative represents a paradigm shift in synergistic, quantum-driven computing. By leveraging the power of advanced hyper-threading and rubber duck debugging methodologies, we have successfully optimized the spaghetti code density to an al dente state, ensuring maximum throughput across all localized mainframes.",
                "",
                "Despite a minor early-stage setback involving the calculation of the velocity of an unladen swallow, cross-functional teams have managed to reverse-engineer the probability of rain. By transforming all precipitation algorithms entirely into pineapples, this breakthrough allows for unprecedented scalability in our cloud-based meteorological deployment.",
                "We have also integrated a completely bespoke machine learning matrix that accurately predicts the number of bugs successfully fixed. Currently hovering at a steady -5, this negative bug-fix ratio is officially documented as a feature, not a bug, designed specifically to keep the continuous integration cycle eternally robust and challenging.",
                "In conclusion, the 100% rubbish generated by this system is entirely intentional, heavily verified by our leading experts, and ready for enterprise deployment. Undefined sleep cycles have contributed to a highly volatile yet wildly creative ecosystem, paving the way for future enhancements in nonsensical data aggregation and synergy."
            ]
        }
    },
    "videosTabData": {
        "videoDatas": [
            {
                "videoURL": "Videos/video_1.mp4",
                "titleText": "Project Introduction"
            },
            {
                "videoURL": "Videos/video_1.mp4",
                "titleText": "Overview of Key Objectives"
            },
            {
                "videoURL": "Videos/video_1.mp4",
                "titleText": "Technology Demonstration"
            },
            {
                "videoURL": "Videos/video_1.mp4",
                "titleText": "Interactive User Experience"
            },
            {
                "videoURL": "Videos/video_1.mp4",
                "titleText": "System Architecture Walkthrough"
            },
            {
                "videoURL": "Videos/video_1.mp4",
                "titleText": "Data Processing Pipeline"
            },
            {
                "videoURL": "Videos/video_1.mp4",
                "titleText": "Feature Showcase"
            },
            {
                "videoURL": "Videos/video_1.mp4",
                "titleText": "Performance and Analytics"
            },
            {
                "videoURL": "Videos/video_1.mp4",
                "titleText": "Future Enhancements"
            },
            {
                "videoURL": "Videos/video_1.mp4",
                "titleText": "Project Summary and Outcomes"
            }
        ]
    },
    "galleryTabData": {
        "galleryDatas": [
            {
                "imageURL": "Gallery/image_1.jpg",
                "titleText": "Project Overview"
            },
            {
                "imageURL": "Gallery/image_2.jpg",
                "titleText": "System Architecture"
            },
            {
                "imageURL": "Gallery/image_3.jpg",
                "titleText": "User Interface Design"
            },
            {
                "imageURL": "Gallery/image_4.jpg",
                "titleText": "Dashboard Analytics"
            },
            {
                "imageURL": "Gallery/image_5.jpg",
                "titleText": "Data Visualization"
            },
            {
                "imageURL": "Gallery/image_6.jpg",
                "titleText": "Interactive Experience"
            },
            {
                "imageURL": "Gallery/image_7.jpg",
                "titleText": "Feature Demonstration"
            },
            {
                "imageURL": "Gallery/image_8.jpg",
                "titleText": "Performance Metrics"
            },
            {
                "imageURL": "Gallery/image_9.jpg",
                "titleText": "Research Findings"
            },
            {
                "imageURL": "Gallery/image_10.jpg",
                "titleText": "Development Process"
            },
            {
                "imageURL": "Gallery/image_11.jpg",
                "titleText": "Technical Implementation"
            },
            {
                "imageURL": "Gallery/image_12.jpg",
                "titleText": "Field Operations"
            },
            {
                "imageURL": "Gallery/image_13.jpg",
                "titleText": "Future Roadmap"
            },
            {
                "imageURL": "Gallery/image_14.jpg",
                "titleText": "Project Highlights"
            },
            {
                "imageURL": "Gallery/image_15.jpg",
                "titleText": "Final Outcomes"
            }
        ]
    },
    "dashboardTabData": {
        "imageVideosURLs": []
    },
    "reportsTabData": {
        "reportDatas": [
            {
                "titleText": "Q3 Idle Loop Automation Analysis",
                "textData": [
                    "Recent diagnostics on the core automation loops indicate a 400% increase in virtual ingredient processing.",
                    "Supply-chain mechanics are operating within expected parameters. However, we noted a slight bottleneck in the burger management pipeline when processing speeds exceed frame rates.",
                    "Recommendation: Implement aggressive object pooling to prevent garbage collection spikes during high-intensity idle phases."
                ]
            },
            {
                "titleText": "Peripheral Latency & Hardware Metrics",
                "textData": [
                    "Extensive stress testing of standard input devices reveals zero drop in polling rates during extended usage.",
                    "The integration of Cosmic Byte wired controllers proved highly resilient, maintaining sub-millisecond response times even when quantum wobble frequencies peaked at 42 Hz.",
                    "No significant stick drift was detected across any test units during the rigorous 72-hour assessment period."
                ]
            },
            {
                "titleText": "Single-Scene Synchronization Stability",
                "textData": [
                    "Tests executed entirely within a single scene without the reliance on external netcode libraries yielded an unexpected 15% performance boost.",
                    "Telemetry confirmed that purging the unnecessary zDistance variables from the primary movement scripts successfully simplified the computational load.",
                    "The waypoint-baking process for all 100 navigation agents now executes flawlessly on initialization."
                ]
            }
        ]
    }
}