{
    "projectTitle": "Gender Sensitization Trainings - Rajkot",
    "aboutTabData": {
        "imageURL": "",
        "aboutDatas": {
            "textData": [
                "Workshops for bus crews using role-plays, real cases, legal grounding, and helpline drills instead of lectures, from early 2025"
            ]
        }
    },
    "videosTabData": {
        "videoDatas": [],
        "idleTimeout": 2.0
    },
    "galleryTabData": {
        "galleryDatas": [
            {
                "imageURL": "Gallery/1.jpg",
                "titleText": "‎"
            },{
                "imageURL": "Gallery/2.jpg",
                "titleText": "‎"
            },{
                "imageURL": "Gallery/3.jpg",
                "titleText": "‎"
            }
        ]
    },
    "dashboardTabData": {
        "imageVideosURLs": []
    },
    "reportsTabData": {
        "reportDatas": [
            {
                "pdfURL": "Reports/1.pdf",
                "titleText": "Gender Sensitization"
            }
        ]
    }
}