{
    "projectTitle": "Complete Street Design of Pedak Road & Guidelines",
    "aboutTabData": {
        "imageURL": "",
        "aboutDatas": {
            "textData": [
                "Redesigned as a complete street with dedicated footpath, raised crossings, tree canopy, and bus lane within existing right-of-way."
            ]
        }
    },
    "videosTabData": {
        "videoDatas": [],
        "idleTimeout": 2.0
    },
    "galleryTabData": {
        "galleryDatas": [
            {
                "imageURL": "Gallery/1 (1).jpg",
                "titleText": "‎"
            },{
                "imageURL": "Gallery/1 (2).jpg",
                "titleText": "‎"
            },{

                "imageURL": "Gallery/1 (3).jpg",
                "titleText": "‎"
            },{

                "imageURL": "Gallery/1 (4).jpg",
                "titleText": "‎"
            },{

                "imageURL": "Gallery/1 (5).jpg",
                "titleText": "‎"
            },{

                "imageURL": "Gallery/1 (6).jpg",
                "titleText": "‎"
            },{

                "imageURL": "Gallery/1 (7).jpg",
                "titleText": "‎"
            },{
                "imageURL": "Gallery/1 (8).jpg",
                "titleText": "‎"
            },{

                "imageURL": "Gallery/1 (9).jpg",
                "titleText": "‎"
            },{
                "imageURL": "Gallery/1 (10).jpg",
                "titleText": "‎"
            }
        ]
    },
    "dashboardTabData": {
        "imageVideosURLs": []
    },
    "reportsTabData": {
        "reportDatas": [
            {
                "pdfURL": "Reports/1.pdf",
                "titleText": "Compllete Street Design Of Pedak Road"
            },
            {
                "pdfURL": "Reports/2.pdf",
                "titleText": "Complete Street Guidelines"
            }
        ]
    }
}